asinValue,title,imageProduct,priceSymbol,price
B071CZXZN7,Adada Hard EVA Case for fits Amazon Fire TV Stick Alexa Voice Remote Streaming Media Player,https://m.media-amazon.com/images/I/6196u04olQL.jpg.jpg,$,12.99
B0BR94LKHZ,"Android TV Box 12.0, Antfraer T95MAX Android TV Box H618 4GB RAM 64GB ROM Android Box Support 2.4G/5.8G WiFi6 Bluetooth 5.0 Ethernet LAN 3D 6K Video Smart TV Box",https://m.media-amazon.com/images/I/81LBxrM-59L.jpg.jpg,$,62.99
B0B57CFYBP,"Allimity Replacement Voice Command Remote Control fit for Amazon Fire TV Stick Lite, 2nd Gen Fire TV Stick, 3rd Gen Fire TV Stick, Fire TV Stick 4K, 2nd Gen Fire TV Cube (No Power and Volume Buttons)",https://m.media-amazon.com/images/I/51sF7E71zfL.jpg.jpg,$,19.99
B01ETRGE7M,Fire TV Stick | Basic Edition (International Version),https://m.media-amazon.com/images/I/513laI4AS8L.jpg.jpg,,0
B073PCG77G,SmartSee MiraScreen Wireless Display Adapter 1080P HDMI Screen Mirroring Media Player TV Stick for Tablet Smartphone,https://m.media-amazon.com/images/I/51WP7G5aVLL.jpg.jpg,$,22.98
B0BLS5DZXB,"3RD GEN L5B83G Replacement Voice Remote for Fire TV Stick (2nd Gen/3rd Gen/Lite/4K), Fire TV Cube (1st Gen and Later), Fire TV (3rd Gen, Pendant Design)",https://m.media-amazon.com/images/I/51R3+ORWldL.jpg.jpg,$,19.99
B0BM8RYVN2,"L5B83G Replacement Voice Remote Control with TV Controls (3rd Gen) Compatible with Fire TV Cube,Fire TV Design, Fire TV Stick Lite",https://m.media-amazon.com/images/I/61XtxMSR2nL.jpg.jpg,$,19.99
B0933D3SN6,2021 Apple TV 4K with 32GB Storage (2nd Generation),https://m.media-amazon.com/images/I/815g8Uo656S.jpg.jpg,$,149.99
B07DNB98HH,"HDMI Switch, BENFEI 4K@60Hz HDMI Switcher 2 Input 1 Output, 1 Input 2 Output, Supports 4K 3D HD 1080P Compatible for Firestick, Xbox PS4 Roku HDTV",https://m.media-amazon.com/images/I/619gJ4rTCgL.jpg.jpg,$,10.99
B08P7YXY4C,"Roku Ultra LT 4K/HDR/HD Streaming Player with Enhanced Voice Remote, Ethernet, MicroSD with Premium 6FT 4K Ready HDMI Cable",https://m.media-amazon.com/images/I/61JR-sPCrmL.jpg.jpg,$,54.98
B0B7DV8L28,"4K 5G Wireless HDMI Display Adapter, SOCLLLife Miracast HDMI Dongle for iPhone/iPad/Android/Mac/Window Streaming YouTube, Tiktok Video/Audio to HDTV/Projector/Monitor for Airplay/Miracast/DLNA/Chrome",https://m.media-amazon.com/images/I/61o6gU-8UgL.jpg.jpg,$,29.99
B08HYS1DR8,"CableCreation USB C to HDMI Cable 6FT, 4K 30hz Type C to HDMI Cord Thunderbolt 3/4 Compatible, Nylon Braided HDMI Cable for Home Office,MacBook/Pro/Air, iPad Pro",https://m.media-amazon.com/images/I/61VhuIsQOJL.jpg.jpg,$,13.99
B00JJY1QG0,Lutron Caséta Wireless Single-Pole/3-Way Smart Lighting Lamp Dimmer and Remote Kit | P-PKG1P-WH | White,https://m.media-amazon.com/images/I/61al3qdgnTL.jpg.jpg,$,49.50
B0BJSKZLSZ,2023 HTV H8 Box Brazil HTV8 H8 TV Brazil Brazilian TV Box Support 2.4GHz/ 5GHz WiFi 4K UHD Bluetooth 5.0,https://m.media-amazon.com/images/I/71tM23l-wFL.jpg.jpg,$,205.00
B089VXSD1H,"NEUMI Atom 4K Ultra-HD Digital Media Player for USB Drives and SD Cards - Plays 4K/UHD 60fps Videos, HEVC/H.265, HDMI and Analog AV, Automatic Playback and Looping Capability",https://m.media-amazon.com/images/I/71U44WyWhBL.jpg.jpg,$,54.99
B07YP94PBJ,"NVIDIA SHIELD Android TV Streaming Media Player; 4K HDR, live sports, Dolby Vision-Atmos, AI-enhanced upscaling, GeForce NOW cloud gaming, Google Assistant Built-In, Works with Alexa",https://m.media-amazon.com/images/I/51irVXBTIrL.jpg.jpg,$,149.99
B09XRGPZS6,AT&T DirecTV Now Android TV Wireless OTT Set-Top Box 2GB RAM DDR4 16GB ROM 1.6GZz Quad-Core 4K Streaming Media Player (Osprey) (Renewed),https://m.media-amazon.com/images/I/51DqzuYbYEL.jpg.jpg,$,79.99
B07PTMZL8T,Fire TV Stick with all-new Alexa Voice Remote bundle - includes Ethernet Adapter and 2-Year Protection Plan,https://m.media-amazon.com/images/I/51N26NZ-W0L.jpg.jpg,$,59.97
B08794HT2G,"fireCable WiFi Extender for Chromcast | Less Buffering, Faster Streaming",https://m.media-amazon.com/images/I/51gNfOdwCKL.jpg.jpg,$,14.99
B0BG9WHRPF,"TV Stick Android - MECOOL KD3 Android TV Stick with Google Netflix Certified, Dol-by Audio 4K Streaming Stick with 2GB RAM and 8GB ROM Supported 2.4G/5G WiFi with Remote Control",https://m.media-amazon.com/images/I/51QkRXOq2NL.jpg.jpg,$,64.99
B0922467VP,Wall Holder Mount for Fire TV Stick Remote (3D Printed in the USA),https://m.media-amazon.com/images/I/51TpyeW7ggL.jpg.jpg,$,9.99