asinValue,title,imageProduct,priceSymbol,price
B08C1W5N87,"Fire TV Stick with Alexa Voice Remote (includes TV controls), free & live TV without cable or satellite, HD streaming device",https://m.media-amazon.com/images/I/51TjJOTfslL.jpg.jpg,$,39.99
B08MQZXN1X,"Fire TV Stick 4K Max streaming device, Wi-Fi 6, Alexa Voice Remote (includes TV controls)",https://m.media-amazon.com/images/I/41Xfz3eizpL.jpg.jpg,$,54.99
B08XVYZ1Y5,"Fire TV Stick 4K, brilliant 4K streaming quality, TV and smart home controls, free and live TV",https://m.media-amazon.com/images/I/41GYmjbeVSL.jpg.jpg,$,49.99
B09BZZ3MM7,"Fire TV Cube, Hands-free streaming device with Alexa, Wi-Fi 6E, 4K Ultra HD",https://m.media-amazon.com/images/I/61-Ps9NldbL.jpg.jpg,$,139.99
B07YNLBS7R,"Fire TV Stick Lite, free and live TV, Alexa Voice Remote Lite, smart home controls, HD streaming",https://m.media-amazon.com/images/I/51Da2Z+FTFL.jpg.jpg,$,29.99
B091G4YP57,"Fire TV Stick Lite, free and live TV, Alexa Voice Remote Lite, smart home controls, HD streaming",https://m.media-amazon.com/images/I/41DTzx56EWL.jpg.jpg,$,29.99
B0BYR8BNQ6,"Replacement Voice Remote (L5B83H),for Fire TV Stick 2nd Gen,Fire TV Stick 3rd Gen, Fire TV Stick 4K, Fire TV Stick Pendant Design,1st Gen & 2nd Fire TV Cube",https://m.media-amazon.com/images/I/614LgYyeQML.jpg.jpg,$,17.99
B0B8C1HYY8,"Certified Refurbished Fire TV Stick 4K streaming device with latest Alexa Voice Remote (includes TV controls), Dolby Vision",https://m.media-amazon.com/images/I/411y5UdVmvL.jpg.jpg,$,44.99
B0BCH5H2R3,"Roku Express (New, 2022) HD Streaming Device with High-Speed HDMI Cable and Simple Remote (no TV controls), Guided Setup, and Fast Wi-Fi",https://m.media-amazon.com/images/I/71tK-UqLSCL.jpg.jpg,$,29.99
B08YQZ6GDC,"Certified Refurbished Fire TV Stick 4K Max streaming device, Wi-Fi 6, Alexa Voice Remote (includes TV controls)",https://m.media-amazon.com/images/I/41XTOfFgUqL.jpg.jpg,$,49.99
B0B8C3WDPH,"Certified Refurbished Fire TV Stick with Alexa Voice Remote (includes TV controls), HD streaming device",https://m.media-amazon.com/images/I/51KKR5uGn6L.jpg.jpg,$,34.99
B08D6WJYD9,"Alexa Voice Remote (3rd Gen) with TV controls, Requires compatible Fire TV device, 2021 release",https://m.media-amazon.com/images/I/41kTYzDaAeL.jpg.jpg,$,29.99
B0916TKFF2,"Roku Express 4K+ | Streaming Player HD/4K/HDR with Roku Voice Remote with TV Controls, Includes Premium HDMI Cable",https://m.media-amazon.com/images/I/71EZAE6fljL.jpg.jpg,$,39.99
B085PL3BJ1,Certified Refurbished Fire TV Stick Lite with Alexa Voice Remote Lite (no TV controls) | HD streaming device | 2020 release,https://m.media-amazon.com/images/I/51Da2Z+FTFL.jpg.jpg,$,24.99
B0B68TP19T,"Voice Remote (3rd Gen) Compatible with Fire TV Stick 4K, Fire TV Stick (2nd & 3rd Gen), Fire TV Cube (1st & 2nd Gen), Fire TV (3rd Gen), Fire TV Stick Lite, 2021 Release",https://m.media-amazon.com/images/I/41P5HsGB-dL.jpg.jpg,$,23.95
B0BNLDT6J3,"Replacement Voice Remote (3rd GEN) L5B83Gfor Amazon Fire TV Stick (2nd Gen, 3rd Gen, Lite, 4K), Fire TV Cube (1st Gen and Later), and Fire TV (3rd Gen)",https://m.media-amazon.com/images/I/51QciXHIadL.jpg.jpg,$,19.99
B0BN2BDM2L,"Fire TV Stick with Alexa Voice Remote Bundle. Includes Fire TV Stick with Alexa Voice Remote (includes TV controls), HD streaming device & Made For Amazon USB Power Cable",https://m.media-amazon.com/images/I/31vEwoFURAL.jpg.jpg,$,61.98
B0BZ15XJJF,"Replacement Voice Remote (3rd GEN) L5B83G fit for Fire TV Stick (2nd Gen, 3rd Gen, Lite, 4K), Fire TV Cube (1st Gen and Later), and Fire TV 3rd Gen",https://m.media-amazon.com/images/I/51ak0BW3aIL.jpg.jpg,$,15.89
B0BMVP178H,"Replacement New Voice Remote (3rd GEN) Compatible Fire TV Stick (2nd Gen, 3rd Gen, Lite, 4K) Fire TV Cube (1st Gen and Later) and Fire TV (3rd Gen)",https://m.media-amazon.com/images/I/51K7VaWGzWL.jpg.jpg,$,20.89
B09RX4HKTD,"Alexa Voice Remote Pro, includes remote finder, TV controls, backlit buttons, requires compatible Fire TV device",https://m.media-amazon.com/images/I/41P-gym5KuL.jpg.jpg,$,34.99
B0BXSPPQVF,"2nd Gen Replacement Voice Remote with Volume and Power Control Compatible with Amazon Fire TV Stick,Fire TV Cube,Fire TV Lite and Fire TV Stick 4K",https://m.media-amazon.com/images/I/71MjfP0nFAL.jpg.jpg,$,19.59
B0BM3YBYYY,"Replacement Voice Remote Control Compatible with Fire TV, Fire TV Stick, Fire TV Stick 4K, Fire TV Cube,Fire TV (Pendant Design)",https://m.media-amazon.com/images/I/51cwpW3qzOL.jpg.jpg,$,19.99
B09KTX8Z7G,"Allimity Replacement Voice Remote (3rd GEN) L5B83G with TV Controls fit for Amazon Fire TV Stick (2nd Gen, 3rd Gen, Lite, 4K), Fire TV Cube (1st Gen and Later), and Fire TV (3rd Gen)",https://m.media-amazon.com/images/I/51mmMgkKF4L.jpg.jpg,$,19.88
B09GCH8HJQ,Fire TV Stick 4K Bundle with 2-Year Protection Plan,https://m.media-amazon.com/images/I/51FaIQv4icL.jpg.jpg,$,54.98
B08C4W91MN,"Replacement Voice Remote Control (2nd GEN) L5B83H with Power and Volume Control fit for Amazon 2nd Gen Fire TV Cube and Fire TV Stick,1st Gen Fire TV Cube, Fire TV Stick 4K, and 3rd Gen Amazon Fire TV",https://m.media-amazon.com/images/I/51-2nxNi6JL.jpg.jpg,$,19.93
B09GC7STM3,Fire TV Stick 4K Essentials Bundle with Remote Cover (Red) and USB Power Cable,https://m.media-amazon.com/images/I/51CpHpSR4LL.jpg.jpg,$,86.97
B09M7CM768,Fhd Streaming Device,https://m.media-amazon.com/images/I/71S07aW3PdL.jpg.jpg,$,34.95
B09C2KFLC5,Billy Buckskin Co. 10 lb. Fatwood Fire Starter Sticks | Easy & Safe Fire Starter | Start a Fire with just 2 Sticks | Rich Lighter Pine Works in Any Weather Conditions | 10 lb. Box,https://m.media-amazon.com/images/I/81IWrIvCH5L.jpg.jpg,$,32.50
B0BY8BGDZS,"3rd Gen Replacement Voice Remote, L5B83G Fire TV Replacement Remote Compatible with Fire TV Cube(1st Gen,2nd Gen), Fire TV Stick (4K,4K Max,Lite)",https://m.media-amazon.com/images/I/61XtxMSR2nL.jpg.jpg,$,19.99
B09X5DL9S5,Roku Streaming Stick 4K 2021 | Streaming Device 4K/HDR/D. Vision with Roku Voice Remote and TV Controls (Renewed),https://m.media-amazon.com/images/I/71MnUkYzP5L.jpg.jpg,$,41.99
B074TC662N,Amazon Ethernet Adapter for Amazon Fire TV Devices,https://m.media-amazon.com/images/I/51lS5gvNgyL.jpg.jpg,$,14.99
B09HR7SWTR,"Roku Express 4K+ 2021 | Streaming Media Player HD/4K/HDR with Smooth Wireless Streaming and Roku Voice Remote with TV Controls, Includes Premium HDMI Cable (Renewed)",https://m.media-amazon.com/images/I/71E4InwfcPL.jpg.jpg,$,34.99
B0BQ64HD3F,"Replacement Voice Remote with TV Controls, Requires Compatible with Fire TV Stick /4K/Max/Lite/Cube",https://m.media-amazon.com/images/I/51+8yp7hHhL.jpg.jpg,$,19.99
B01N9O3UTF,"fire-Cable Plus Wireless Adapter, Powers Streaming TV Sticks Directly from TV USB Port (Eliminates AC Outlet and Cords)",https://m.media-amazon.com/images/I/41AT6luULgL.jpg.jpg,$,11.99
B09M9VBBKQ,"(3 Pack) ONEBOM Firestick Remote Cover 3rd Gen with Alexa Voice Remote 4K/4K Max,Fire TV Stick Cover Glow in The Dark,Anti Slip Silicone Protective Case with Lanyard(Glow Green&Blue&Red)",https://m.media-amazon.com/images/I/71s1o0HuXeL.jpg.jpg,$,9.99
B089655HQV,"TiVo Stream 4K – Every Streaming App and Live TV on One Screen – 4K UHD, Dolby Vision HDR and Dolby Atmos Sound – Powered by Android TV – Plug-In Smart TV",https://m.media-amazon.com/images/I/61CI2BW3JLL.jpg.jpg,$,39.44
B0BWF9KG31,"(3rd GEN) L5B83G Voice Replacement Remote for Fire TV Stick (2nd Gen/3rd Ge/Lite/4K) Fire TV Cube (1st Gen & 2nd Gen) and Fire TV (3rd Gen, Pendant Design)",https://m.media-amazon.com/images/I/51Y6GFxcJtL.jpg.jpg,$,19.99
B09YD2KNYM,"L5B83H Replacement Voice Remote Control (2nd GEN) fit for Amazon 2nd Gen Fire TV Stick, 2nd Gen Fire TV Cube, 1st Gen Fire TV Cube, Fire TV Stick 4K, Fire TV Stick Lite, 3rd Gen Amazon Fire TV",https://m.media-amazon.com/images/I/516xVTTctNL.jpg.jpg,$,18.59
B09TD4BV2Y,"Fire TV Stick 4K with latest Alexa Voice Remote (includes TV controls, Dolby Vision) + Star Wars The Mandalorian remote cover (Grogu Green)",https://m.media-amazon.com/images/I/41Ahz9HZrcL.jpg.jpg,$,69.98
B0BYC2JYWW,"Replacement Voice Remote (3rd GEN) L5B83G fit for Fire TV Stick (2nd Gen, 3rd Gen, Lite, 4K), Fire TV Cube (1st Gen and Later), and Fire TV (3rd Gen)",https://m.media-amazon.com/images/I/61VJpUoDE-L.jpg.jpg,$,23.89
B09SMGNVJK,Fire TV Gaming Bundle including Fire TV Stick 4K and Luna Controller,https://m.media-amazon.com/images/I/41A+h8VMAaS.jpg.jpg,$,119.98
B09ZYQ5CSQ,"Replacement Voice Remote Control (2nd GEN) DR49WK B PE59CV fit for Amazon Fire TV, Fire TV Stick Box, Fire TV Cube (1st Gen,2nd Gen) Fire TV Stick (2nd Gen,3rd Gen, Lite,4K,LY73PR)",https://m.media-amazon.com/images/I/5158NLKmjlL.jpg.jpg,$,25.99
B07NYTZYQL,"EasyGoProducts Approx. 120 Eco-Stix Fatwood Fire Starter Kindling Firewood Sticks – 100% Organic – Firestarter for Wood Stoves, Fireplaces, Campfires, Bonfires, 10 Lbs",https://m.media-amazon.com/images/I/71XYYW+gBaL.jpg.jpg,$,24.99
B0B1BSN56H,"Oassuose USB Power Cable Adapter for Fire TV Stick,Powers Streaming TV Sticks Directly from TV USB Port(Eliminates AC Adapter and Very Long Power Cable)",https://m.media-amazon.com/images/I/41Ot64B9FAL.jpg.jpg,$,15.99
B09BKCDXZC,Roku Streaming Stick 4K | Streaming Device 4K/HDR/Dolby Vision with Roku Voice Remote and TV Controls,https://m.media-amazon.com/images/I/71wrIZujPIL.jpg.jpg,$,47.49
B077N9XJ7Q,"iPazzPort Mini Bluetooth Wireless Keyboard Remote with Backlit for Fire TV Stick 4k 2021, Fire Cube, Android Tv Box, Smart TV",https://m.media-amazon.com/images/I/61C7L9UBV1L.jpg.jpg,$,22.49
B098TN55LV,Remote Cover for TV Stick (3rd Gen) Silicone Protective Case TV Stick 4k&4K Max (2021 Release) Shockproof Silicone case with Lanyard(Pink),https://m.media-amazon.com/images/I/61Vqog4tVDS.jpg.jpg,$,10.99
B0BZ761C45,"Voice Replacement Remote Control L5B83H for Fire TV Stick Lite,Fire TV Stick 2nd Gen and 3rd Gen,Fire TV Stick 2020 Release and 4K,Fire TV Cub (1st and 2nd Gen) Fire TV 3rd Gen,Pendant Design",https://m.media-amazon.com/images/I/518dhOdQKmL.jpg.jpg,$,15.99
B07YP9FBMM,"NVIDIA SHIELD Android TV Pro Streaming Media Player; 4K HDR movies, live sports, Dolby Vision-Atmos, AI-enhanced upscaling, GeForce NOW cloud gaming, Google Assistant Built-In, Works with Alexa",https://m.media-amazon.com/images/I/61rowppY2TL.jpg.jpg,$,199.99
B09QJQTM92,"L5B83G Voice Replacement Remote Control (3rd GEN) Compatible for Fire TV Stick (2nd Gen, 3rd Gen, Lite, 4K), Fire TV Cube (1st Gen and Later), and Fire TV (3rd Gen, Pendant Design)",https://m.media-amazon.com/images/I/51F42kv41ZL.jpg.jpg,$,16.98
B09SW785GQ,"2Pack Remote Cover for Firtvstick 4K Max (3rd Gen) 2021,Silicone Protective Case Compatible with Firtv4k TV Stick Alexa Voice Remote Control with Lanyards,Anti-Slip,Shockproof(Rose Red&Sky Blue)",https://m.media-amazon.com/images/I/71bB4-iya5L.jpg.jpg,$,7.99
B09M3WBN7J,"[2 Pack] Wevove Firestick Remote Cover Compatible with Alexa Voice Remote 4k/Max/Lite (3rd Gen), Firesticktvs Remote Case with Wrist Strap, Fire Stick Cover Glow in The Dark",https://m.media-amazon.com/images/I/71SdYZyAnRL.jpg.jpg,$,6.99
B0B7F8DZ22,[3 Pack] Remote Cover for Firestick Remote (3rd Gen) Anti Slip Silicone Protective Case Cover Compatible with Fire TV FireStick 4K / 4K Max Voice Remote,https://m.media-amazon.com/images/I/711M7RZpi1L.jpg.jpg,$,8.99
B08KRV7S22,"Chromecast with Google TV (4K)- Streaming Stick Entertainment with Voice Search - Watch Movies, Shows, and Live TV in 4K HDR - Snow",https://m.media-amazon.com/images/I/51M+qQwzrdL.jpg.jpg,$,49.75
B0B2JB325P,"Replacement Voice Remote fit for Fire TV (3rd Gen, Pendant Design),Fire TV Stick (2nd Gen,3r Gen,4K,4K Max),Fire TV Stick Lite,Fire TV Cube Remote (1st and 2nd Gen)",https://m.media-amazon.com/images/I/51IeU+zjeOL.jpg.jpg,$,25.99
B09GVS3WBW,Roku Ultra LT Streaming Media Player 4K/HD/HDR w/ 4K HDMI Cable,https://m.media-amazon.com/images/I/61Rwc2YgHLL.jpg.jpg,$,53.00
B0BTKP4P6S,"Replacement Voice Remote fit for Fire TV (3rd Gen, Pendant Design),Fire TV Stick (3r Gen,4K,4K Max),Fire TV Stick Lite,Fire TV Cube Remote",https://m.media-amazon.com/images/I/51RhVl6B0kL.jpg.jpg,$,24.99
B098NTBNQ8,"QFUP USB Power Adapter for Fire TV Stick, Replacement Power Cord for Fire Stick TV USB Power Cable Powers Your Fire Stick Directly Form Your TV'S USB Port （Eliminates The AC Outlet and Power Cord）",https://m.media-amazon.com/images/I/51nFPvAVnhL.jpg.jpg,$,19.99
B07BKT396T,"fire-Cable Ethernet Adapter for WiFi TVSticks & Streaming Media Players (Connects TV Stick to a Ethernet for Fast Playback, Streaming and Less Buffering)",https://m.media-amazon.com/images/I/615hNuWL8mL.jpg.jpg,$,24.97
B0BZCPG87H,"Replacement Remote Control (2nd GEN) with Voice Function fit for Fire TV Stick(4K & Lite),Fire TV Cube (1st & 2nd Gen),and 3rd Gen Amazon Fire TV (L5B83H)",https://m.media-amazon.com/images/I/51OVZQrWZyL.jpg.jpg,$,15.99
B0BWVXQNHL,Replacement Voice Remote 2rd Gen for Amazon Fire TV Stick Lite Fire TV Stick 2nd Gen and 3rd Gen Fire TV Stick 2020 Release Fire TV Stick 4K/Max Fire TV Cube (1st and 2nd Gen) Fire TV 3rd Gen,https://m.media-amazon.com/images/I/61OXJtjUvtL.jpg.jpg,$,15.99
B0BB38SLFX,"L5B83H Voice Remote Control Replacement for Fire TV Stick Lite,Fire TV Strick,Fire TV Cube",https://m.media-amazon.com/images/I/51anX8-RJaL.jpg.jpg,$,19.99
B07WVFCVJN,Roku Express HD Streaming Media Player with High Speed HDMI Cable and Simple Remote,https://m.media-amazon.com/images/I/71hx9HgKA2L.jpg.jpg,$,29.99
B073QZGKVF,Firepower USB Power Adapter + 10-Ft Long USB Cable for Fire TV Stick,https://m.media-amazon.com/images/I/31ZxBBow9aL.jpg.jpg,$,13.95
B09V9CJZB6,Remote Cover Protective Case Compatible with Firestick 3rd Gen Fire TV Stick 2021 4K Alexa Voice Remote Control Non Slip Silicone Shock Resistant Sleeve with Lanyard 1 Pack Purple,https://m.media-amazon.com/images/I/51r-z059RsL.jpg.jpg,$,8.97
B0BJQQQZYY,"Replacement Insignia Fire TV Remote with Voice Control NS-RCFNA-21,Low Power TECH Remote Compatible with Insignia Fire Smart TVs and Toshiba Fire TVs with 4 Shortcut Buttons",https://m.media-amazon.com/images/I/616OIMWyaBL.jpg.jpg,$,22.99
B0B6894XGM,"Xiaomi Mi TV Stick 4K Ultra HD Streaming Device, Android TV 11 with Google Assistant Voice Remote Control Streaming Media Player, Chromecast Built-in, 2GB 8GB HDR/AV1/2.4G/5G WiFi/BT 5.2, 2022 Latest",https://m.media-amazon.com/images/I/51s11h8AJTL.jpg.jpg,$,59.99
B073QYKT1Q,"firePower USB Power Cable for Fire TV Stick: Power Your Fire Stick without the Clutter, Eliminates the Need for an AC Power Adapter",https://m.media-amazon.com/images/I/A1PydGT+qHL.jpg.jpg,$,9.95
B00R92CL5E,"NETGEAR Wi-Fi Range Extender EX3700 - Coverage Up to 1000 Sq Ft and 15 Devices with AC750 Dual Band Wireless Signal Booster & Repeater (Up to 750Mbps Speed), and Compact Wall Plug Design",https://m.media-amazon.com/images/I/61z5oOk5fzL.jpg.jpg,,0
B0BR45YB7W,"2023 Upgraded Digital TV Antenna Up to 550+ Miles Range, Indoor Outdoor Antenna for All Old Smart HDTVs, 360° Reception 4K 1080P HD Antenna with Amplifier Signal Booster/26Ft Premium Coaxial Cable",https://m.media-amazon.com/images/I/61wDOU06J-L.jpg.jpg,$,32.99
B0BN2BDM2L,"Fire TV Stick with Alexa Voice Remote Bundle. Includes Fire TV Stick with Alexa Voice Remote (includes TV controls), HD streaming device & Made For Amazon USB Power Cable",https://m.media-amazon.com/images/I/31vEwoFURAL.jpg.jpg,$,61.98
B0BVYBR8TJ,"Lightning to HDMI Adapter for iPhone iPad iPod, [Apple MFi Certified] Digital AV Adapter 1080P Video & Audio Sync Screen Converter with Lightning Charging Port, Perfect for HDTV, Monitor, Projector.",https://m.media-amazon.com/images/I/51FejCk7UjL.jpg.jpg,$,17.99
B08T6JZTH4,"Amazon Fire TV 75"" Omni Series 4K UHD smart TV with Dolby Vision, hands-free with Alexa",https://m.media-amazon.com/images/I/51slfo1weAL.jpg.jpg,$,799.99
B0BGGMB98D,"TV Antenna for Smart TV - Amplified HDTV Indoor Digital Antenna with 350+ Mile Range 17FT Cable Support for 4K 1080p Fire TV Stick and All Old TVs, Outdoor Smart Antenna",https://m.media-amazon.com/images/I/516HFIu+AJL.jpg.jpg,$,39.99
B00ZVJAF9G,Fire TV Stick with Voice Remote,https://m.media-amazon.com/images/I/51ZhY0hRxKL.jpg.jpg,$,49.99
B09KXNWB7N,"L5B83H Voice Replacement Remote Control (2nd Gen) Fit for Amazon Fire TV Stick 4K, 1st Gen Fire TV Cube, 2nd Gen Fire TV Cube, Fire TV Stick 2nd Gen(3rd Gen),Fire TV Stick Lite,Amazon Fire TV 3rd Gen",https://m.media-amazon.com/images/I/51ad628f5HL.jpg.jpg,$,20.99
B00R92CL5E,"NETGEAR Wi-Fi Range Extender EX3700 - Coverage Up to 1000 Sq Ft and 15 Devices with AC750 Dual Band Wireless Signal Booster & Repeater (Up to 750Mbps Speed), and Compact Wall Plug Design",https://m.media-amazon.com/images/I/61z5oOk5fzL.jpg.jpg,,0
B0BNP1VGQY,"Google Chromecast - Streaming Device with HDMI Cable and Voice Search Remote - Stream Shows, Music, Photos, Sports from Phone to TV - Includes Cleaning Cloth, Pouch - HD Version - Snow",https://m.media-amazon.com/images/I/61usl1OiHoL.jpg.jpg,$,42.95
B08YYTVKGZ,"Dynalink Android TV Box, Android 10 Support 4K HDR Smart Streaming Media Player",https://m.media-amazon.com/images/I/61omvUghVhL.jpg.jpg,$,29.99
B07SY88HQY,"Android TV Box 10.0, Android Box 2GB RAM 16GB ROM H616 Quad-Core CPU 2.4G+5GHz WiFi 100M LAN Ethernet BT 4.0 4K 6K Ultra HD Output H.265 Decoding Smart TV Box with Backlit Mini Wireless Keyboard",https://m.media-amazon.com/images/I/71UBrlfMvfL.jpg.jpg,$,37.49
B0BY8BGDZS,"3rd Gen Replacement Voice Remote, L5B83G Fire TV Replacement Remote Compatible with Fire TV Cube(1st Gen,2nd Gen), Fire TV Stick (4K,4K Max,Lite)",https://m.media-amazon.com/images/I/61XtxMSR2nL.jpg.jpg,$,19.99
B0BR3Z5V59,"Replacement Remote for All Toshiba Fire TVs and Insignia Fire/Smart TVs with 6 Shortcut Buttons Netflix, Prime Video, ImdbTV, Hulu",https://m.media-amazon.com/images/I/51dJ5xw63sL.jpg.jpg,$,8.99
B07F1ZVX9V,"Apple TV 32GB 1080p HD Streaming Media Player with Dolby Digital and Voice Search by Asking The Siri Remote (4th Generation), Black (Renewed)",https://m.media-amazon.com/images/I/415kIHlFkBS.jpg.jpg,$,159.49
B07HDBZN7Q,"Roku Premiere | HD/4K/HDR Streaming Media Player, Simple Remote and Premium HDMI Cable, Black",https://m.media-amazon.com/images/I/61RUbUwBbZL.jpg.jpg,$,30.99
B0BY521K85,"Replacement Voice Remote Control L5B83H (2nd Gen) Fit for Fire TV Stick Lite, Fire TV Stick 4, Fire TV Stick 2nd Gen (3rd Gen), Fire TV Cube (3rd Gen), Fire TV 3rd, No Battery",https://m.media-amazon.com/images/I/31Him-IDYuL.jpg.jpg,$,17.99
B09S5YPC2M,"Replacement Remote for All Toshiba Fire TVs and Insignia Fire/Smart TVs with 6 Shortcut Buttons Netflix, Prime Video, ImdbTV, Hulu and More.",https://m.media-amazon.com/images/I/519f9JnCD0L.jpg.jpg,$,12.89
B08G8JH836,"Roku Streambar | 4K/HD/HDR Streaming Media Player & Premium Audio, All In One, Includes Roku Voice Remote",https://m.media-amazon.com/images/I/817oM8ew4YL.jpg.jpg,$,116.19
B098JMJ93W,"Fire TV Stick (International Version), HD streaming device, Alexa Voice Remote",https://m.media-amazon.com/images/I/41hN+otuUUL.jpg.jpg,$,59.99
B0BHTPX7LC,2022 Newest HD TV Antenna Long 120+ Miles Range - Support 4K 8K 1080p Fire tv Stick and All TV's - Indoor Smart Switch Amplifier Signal Booster - Free Local Channels,https://m.media-amazon.com/images/I/51k8M1M0OmL.jpg.jpg,$,29.99
B0BXNXZX77,"Voice Remote (3rd Gen) Replacement Remote Compatible with Fire TV Stick 4K, Fire TV Stick (2nd & 3rd Gen), Fire TV Cube (1st & 2nd Gen), Fire TV (3rd Gen), Fire TV Stick Lite",https://m.media-amazon.com/images/I/61r+TSmsPbL.jpg.jpg,$,16.49
B0779JNY8H,Roku Streaming Stick+ | HD/4K/HDR Streaming Device with Long-range Wireless and Voice Remote with TV Controls (Renewed),https://m.media-amazon.com/images/I/514apInrrpL.jpg.jpg,,0
B07F2191MB,"Apple TV 4K HD 32GB Streaming Media Player HDMI with Dolby Digital and Voice search by Asking the Siri Remote, Black, MQD22LL/A-32G (Renewed)",https://m.media-amazon.com/images/I/617YFuvIAxL.jpg.jpg,$,159.49
B07ZQH6YGY,"Roku Express HD Streaming Media Player, Black (Renewed)",https://m.media-amazon.com/images/I/71hx9HgKA2L.jpg.jpg,$,24.50
B0B1QJQG5Z,"Replacement Voice Remote L5B83G (3rd GEN) fit for Fire TV Stick (2nd Gen, 3rd Gen, Lite, 4K), Fire TV Cube (1st Gen & 2nd Gen), and Fire TV (3rd Gen, Pendant Design)",https://m.media-amazon.com/images/I/51utg+ggBYL.jpg.jpg,$,18.99
B0BXPBFCWR,"Replacement Voice Remote Control L5B83H (2nd GEN) fit for 2nd Gen Fire TV Stick, 2nd Gen Fire TV Cube, 1st Gen Fire TV Cube, Fire TV Stick 4K, Fire TV Stick Lite, 3rd Gen Fire TV",https://m.media-amazon.com/images/I/71J7lvNmJ2L.jpg.jpg,$,15.98
B01MS1PMML,"fireCable Wirless Adapter for Fire Stick, Powers your FireStick Directly from TV USB Port (Declutters TV Wires by Eliminating AC Outlet)",https://m.media-amazon.com/images/I/51P3O28A+gL.jpg.jpg,$,11.99
B09KXNWB7N,"L5B83H Voice Replacement Remote Control (2nd Gen) Fit for Amazon Fire TV Stick 4K, 1st Gen Fire TV Cube, 2nd Gen Fire TV Cube, Fire TV Stick 2nd Gen(3rd Gen),Fire TV Stick Lite,Amazon Fire TV 3rd Gen",https://m.media-amazon.com/images/I/51ad628f5HL.jpg.jpg,$,20.99
B0BW351KWP,"Replacement Voice Remote (3rd Gen) with TV Controls, Comes with Free Blue Remote Cover. Compatible with Fire TV Stick/fire Stick 4k/Max/Lite/Cube/Google chromecast 4k+, Amazon fire Stick",https://m.media-amazon.com/images/I/61u7AnMV4eL.jpg.jpg,$,18.98
B0B1X19XXQ,"L5B83H Replacement Voice Remote Control Applicable for Amazon 2nd Gen Fire Stick TV, Fire TV Cube（2nd & 1st Gen）, Fire TV Stick 4K, and Pendant Design Fire TV 3nd Gen",https://m.media-amazon.com/images/I/51xiLuAQUGL.jpg.jpg,$,16.79
B08S1TFDLD,"fireCable Super Long (15') Streaming Stick USB Cable, Replacement Adapter for Streaming TV Sticks (Eliminates Extension Cords)",https://m.media-amazon.com/images/I/61WN3DoToWL.jpg.jpg,$,17.99
B0B1QJQG5Z,"Replacement Voice Remote L5B83G (3rd GEN) fit for Fire TV Stick (2nd Gen, 3rd Gen, Lite, 4K), Fire TV Cube (1st Gen & 2nd Gen), and Fire TV (3rd Gen, Pendant Design)",https://m.media-amazon.com/images/I/51utg+ggBYL.jpg.jpg,$,18.99
B0BYHLCPRB,"TUOVAR Universal Replacement Voice Remote Control Compatible for Amazon Fire TV Stick and for Amazon Fire TV Cube, for Amazon Fire TV Stick 4K,for Amazon Fire TV Stick Lite",https://m.media-amazon.com/images/I/51XtcdraFJL.jpg.jpg,$,20.99
B01MS1PMML,"fireCable Wirless Adapter for Fire Stick, Powers your FireStick Directly from TV USB Port (Declutters TV Wires by Eliminating AC Outlet)",https://m.media-amazon.com/images/I/51P3O28A+gL.jpg.jpg,$,11.99
B0BNP1VGQY,"Google Chromecast - Streaming Device with HDMI Cable and Voice Search Remote - Stream Shows, Music, Photos, Sports from Phone to TV - Includes Cleaning Cloth, Pouch - HD Version - Snow",https://m.media-amazon.com/images/I/61usl1OiHoL.jpg.jpg,$,42.95
B0B6GSTFM8,"Google Chromecast - Streaming Device with HDMI Cable - Stream Shows, Music, Photos, and Sports from Your Phone to Your TV with Microfiber Cloth and Travel Carrying Pouch - Charcoal, Black",https://m.media-amazon.com/images/I/71goLLr6e1L.jpg.jpg,$,49.95
B09N6Y5BTL,"Amazon Fire TV 75"" Omni QLED Series 4K UHD smart TV, Dolby Vision IQ, local dimming, hands-free with Alexa",https://m.media-amazon.com/images/I/51iRCVZ9P-L.jpg.jpg,$,"1,099.99"
B07TRZXLMC,"Android TV Box, Diyomate 4K Android Smart TV Box Amlogic S905 Quad Core Media Player Support 3D WiFi HDMI for Home Entertainment",https://m.media-amazon.com/images/I/51vrmB2OBEL.jpg.jpg,$,26.99
B074SC2BR3,"Firepower Braided USB Power Cable for Fire TV Stick, Power up Your Fire TV Stick Using Your TV’s USB, Eliminates The Need for an AC Power Adapter, Clutter-Free Solution",https://m.media-amazon.com/images/I/91kavObYUxL.jpg.jpg,$,8.90
B094GSJWJC,"[2 Pack] Firestick Remote Cover, Replacement for FireStick Streaming Media Device |Firesticktv 4k+ 2021 | Fire 4K Max | Fire Stick Lite |Fire Stick Cube | (Sky Blue Glow & Green Glow)…",https://m.media-amazon.com/images/I/61fMAiRQw0L.jpg.jpg,$,7.99
B09DKJ9TQX,Dreamlink/Formuler Formuler Z10 Pro Max Android 10 Dual Band 5G Gigabit LAN 4GB Ram 32GB ROM 4K + Extra 8K HDMI Cable + Extra Premium Remote Control + Extra Magnetic Phone Car Mount,https://m.media-amazon.com/images/I/61U5RqnhUFL.jpg.jpg,$,169.99
B08QNL12P4,"Roku Streambar | 4K/HD/HDR Streaming Media Player & Premium Audio, All In One, Includes Roku Voice Remote (Renewed)",https://m.media-amazon.com/images/I/817oM8ew4YL.jpg.jpg,$,84.99
B0BY896VPX,"Replacement Remote Control (L5B83G) with Voice Function fit for Fire TV Stick /4K/Max/Lite/Cube,and for Fire TV Cube (1st Gen and Later)",https://m.media-amazon.com/images/I/613LDVsmaOL.jpg.jpg,$,15.99
B07HDBZN7Q,"Roku Premiere | HD/4K/HDR Streaming Media Player, Simple Remote and Premium HDMI Cable, Black",https://m.media-amazon.com/images/I/61RUbUwBbZL.jpg.jpg,$,30.99
B08SVZ775L,"Amazon Fire TV 50"" 4-Series 4K UHD smart TV, stream live TV without cable",https://m.media-amazon.com/images/I/51QBHKpw5dL.jpg.jpg,$,279.99
B08G8JH836,"Roku Streambar | 4K/HD/HDR Streaming Media Player & Premium Audio, All In One, Includes Roku Voice Remote",https://m.media-amazon.com/images/I/817oM8ew4YL.jpg.jpg,$,116.19
B0793PMZW3,"Android TV Box 12.0, T95Z Plus H618 Quad-Core Cortex-A53 CPU 2GB RAM 16GB ROM, 2.4GHz/5GHz Dual Band WiFi6 6K Ultra HD Resolution Bluetooth 5.0 with Backlit Mini Wireless Keyboard",https://m.media-amazon.com/images/I/71Wd6jgtQEL.jpg.jpg,$,45.99
B0BCHYQLZQ,"TV Stick 4K Streaming Stick Device | Android 11.0 KD5 Amlogic S805X2 Netflix Google Certified TV Box Media Player Support 1GB 8GB AV1/2.4G/5G WiFi 5 /BT 5.0, Dolby Atmos with Voice Remote Controls",https://m.media-amazon.com/images/I/51R1-ZyocdL.jpg.jpg,$,59.99
B09F3J5VKG,"Pink Case Replacement for TV Stick (3rd Generation) / 4K Max 2021 Release Voice Remote, Silicone Protector Skin Sleeve Glow in Dark for Women Girl - LEFXMOPHY",https://m.media-amazon.com/images/I/71ecs0S-HtL.jpg.jpg,$,8.99
B0878WQ4WM,"fireCable XXL Extender for Amazon FireStick - Improves Buffering, Faster Streaming",https://m.media-amazon.com/images/I/51inCy0KrrL.jpg.jpg,$,18.99
